{"adapter_sha256":"a8aaaffee376dbbc91e48682d49b334fa617eb1dd38156637cda5809f1d24857","base_commit":"ae003913a39f3bdf9bbbd8f71a1ed681fd044d8b","candidate_patch_apply_status":"applied","candidate_patch_sha256":"e3b0c44298fc1c149afbf4c8996fb92427ae41e4649b934ca495991b7852b855","collected_tests":["supports http with nodejs compression algorithms GZIP decompression should not fail if response content-length header is missing (GZIP)","supports http with nodejs compression algorithms GZIP decompression should not fail with an empty response with content-length header (Z_BUF_ERROR)","supports http with nodejs compression algorithms GZIP decompression should not fail with an empty response without content-length header (Z_BUF_ERROR)","supports http with nodejs compression algorithms GZIP decompression should not fail with chunked responses (without Content-Length header)","supports http with nodejs compression algorithms GZIP decompression should support decompression","supports http with nodejs compression algorithms br decompression should not fail if response content-length header is missing (br)","supports http with nodejs compression algorithms br decompression should not fail with an empty response with content-length header (Z_BUF_ERROR)","supports http with nodejs compression algorithms br decompression should not fail with an empty response without content-length header (Z_BUF_ERROR)","supports http with nodejs compression algorithms br decompression should not fail with chunked responses (without Content-Length header)","supports http with nodejs compression algorithms br decompression should support decompression","supports http with nodejs compression algorithms compress decompression should not fail if response content-length header is missing (compress)","supports http with nodejs compression algorithms compress decompression should not fail with an empty response with content-length header (Z_BUF_ERROR)","supports http with nodejs compression algorithms compress decompression should not fail with an empty response without content-length header (Z_BUF_ERROR)","supports http with nodejs compression algorithms compress decompression should not fail with chunked responses (without Content-Length header)","supports http with nodejs compression algorithms compress decompression should support decompression","supports http with nodejs compression algorithms deflate decompression should not fail if response content-length header is missing (deflate)","supports http with nodejs compression algorithms deflate decompression should not fail with an empty response with content-length header (Z_BUF_ERROR)","supports http with nodejs compression algorithms deflate decompression should not fail with an empty response without content-length header (Z_BUF_ERROR)","supports http with nodejs compression algorithms deflate decompression should not fail with chunked responses (without Content-Length header)","supports http with nodejs compression algorithms deflate decompression should support decompression","supports http with nodejs compression algorithms deflate-raw decompression should not fail if response content-length header is missing (deflate)","supports http with nodejs compression algorithms deflate-raw decompression should not fail with an empty response with content-length header (Z_BUF_ERROR)","supports http with nodejs compression algorithms deflate-raw decompression should not fail with an empty response without content-length header (Z_BUF_ERROR)","supports http with nodejs compression algorithms deflate-raw decompression should not fail with chunked responses (without Content-Length header)","supports http with nodejs compression algorithms deflate-raw decompression should support decompression","supports http with nodejs compression algorithms gzip decompression should not fail if response content-length header is missing (gzip)","supports http with nodejs compression algorithms gzip decompression should not fail with an empty response with content-length header (Z_BUF_ERROR)","supports http with nodejs compression algorithms gzip decompression should not fail with an empty response without content-length header (Z_BUF_ERROR)","supports http with nodejs compression algorithms gzip decompression should not fail with chunked responses (without Content-Length header)","supports http with nodejs compression algorithms gzip decompression should support decompression","supports http with nodejs compression should support disabling automatic decompression of response data","supports http with nodejs compression should support gunzip error handling","supports http with nodejs compression should support transparent gunzip"],"duration_ms":670,"error_class":null,"exit_code":3,"fail_to_pass":{"failure":["supports http with nodejs compression algorithms GZIP decompression should not fail if response content-length header is missing (GZIP)","supports http with nodejs compression algorithms GZIP decompression should not fail with chunked responses (without Content-Length header)","supports http with nodejs compression algorithms GZIP decompression should support decompression"],"success":[]},"harness_mode":"adapted","harness_revision":"726c5461e2ef52d83cf1ea2107870a8bb3328d57","instance_id":"axios__axios-5892","official_report_sha256":null,"official_source_lock_sha256":"f7e8a6e953d3351fd9c4dcea471222a277d55af7b5c25d384bda251b91c51a71","pass_to_pass":{"failure":[],"success":["supports http with nodejs compression algorithms GZIP decompression should not fail with an empty response with content-length header (Z_BUF_ERROR)","supports http with nodejs compression algorithms GZIP decompression should not fail with an empty response without content-length header (Z_BUF_ERROR)","supports http with nodejs compression algorithms br decompression should not fail if response content-length header is missing (br)","supports http with nodejs compression algorithms br decompression should not fail with an empty response with content-length header (Z_BUF_ERROR)","supports http with nodejs compression algorithms br decompression should not fail with an empty response without content-length header (Z_BUF_ERROR)","supports http with nodejs compression algorithms br decompression should not fail with chunked responses (without Content-Length header)","supports http with nodejs compression algorithms br decompression should support decompression","supports http with nodejs compression algorithms compress decompression should not fail if response content-length header is missing (compress)","supports http with nodejs compression algorithms compress decompression should not fail with an empty response with content-length header (Z_BUF_ERROR)","supports http with nodejs compression algorithms compress decompression should not fail with an empty response without content-length header (Z_BUF_ERROR)","supports http with nodejs compression algorithms compress decompression should not fail with chunked responses (without Content-Length header)","supports http with nodejs compression algorithms compress decompression should support decompression","supports http with nodejs compression algorithms deflate decompression should not fail if response content-length header is missing (deflate)","supports http with nodejs compression algorithms deflate decompression should not fail with an empty response with content-length header (Z_BUF_ERROR)","supports http with nodejs compression algorithms deflate decompression should not fail with an empty response without content-length header (Z_BUF_ERROR)","supports http with nodejs compression algorithms deflate decompression should not fail with chunked responses (without Content-Length header)","supports http with nodejs compression algorithms deflate decompression should support decompression","supports http with nodejs compression algorithms deflate-raw decompression should not fail if response content-length header is missing (deflate)","supports http with nodejs compression algorithms deflate-raw decompression should not fail with an empty response with content-length header (Z_BUF_ERROR)","supports http with nodejs compression algorithms deflate-raw decompression should not fail with an empty response without content-length header (Z_BUF_ERROR)","supports http with nodejs compression algorithms deflate-raw decompression should not fail with chunked responses (without Content-Length header)","supports http with nodejs compression algorithms deflate-raw decompression should support decompression","supports http with nodejs compression algorithms gzip decompression should not fail if response content-length header is missing (gzip)","supports http with nodejs compression algorithms gzip decompression should not fail with an empty response with content-length header (Z_BUF_ERROR)","supports http with nodejs compression algorithms gzip decompression should not fail with an empty response without content-length header (Z_BUF_ERROR)","supports http with nodejs compression algorithms gzip decompression should not fail with chunked responses (without Content-Length header)","supports http with nodejs compression algorithms gzip decompression should support decompression","supports http with nodejs compression should support disabling automatic decompression of response data","supports http with nodejs compression should support gunzip error handling","supports http with nodejs compression should support transparent gunzip"]},"pristine_runtime_lock_sha256":"9891aba2d22413f25cdbad6addd05cb2fdd8b91d11b9d3dbacd7cd8b5f1802c8","probe_kind":"no_op","report_sha256":"17749a04891a6f0a3be60dd6c20dc35d0277af997667167346c240610389bf91","report_type":"harness_probe","resolved":false,"schema_version":"v1","skipped_tests":[],"test_collected":true,"test_executed":true,"test_log_sha256":"3c22587a82bbb85f9271a363f6218c945810b6c71febb8ad5d964672e8725b3a","test_patch_apply_status":"applied","test_patch_sha256":"6c72b7b060d546b8cb1fe44b7